File,Date,Course,Region,Canton,Difficulte,X_map,Y_map,Elevation_max,Elevation_min,Elevation,Risque,Groupe,Itineraire,Recis,DistanceGPX,SkiRando,Marche,Velo,Camping,X_norm,Y_norm,Latitude,Longitude,Strava
2020_01_24_la_fava,24.1.2020,La Fava,"Conthey, Mayens de My",VS,PD+,2587775,1127888,2582,1268,1314,2,Laurent,"Au départ de Coppet (1268m), suivre la route en direction des Mayens de My. Couper à travers les pré, jusqu'à atteindre la lisière de la forêt (1700m). De là, poursuivre en direction de la lisière supérieure, puis se diriger vers l'alpage du Pointet (1947m). Une fois ce dernier atteint, se diriger vers le NW, en visant l'arrête pré-sommital de la Fava. Poursuivre le lomng de celle-ci en direction du sommet d'hiver. Sur les derniers mètre, potentiellement déchausser les ski pour atteindre la cime (2582m). Descente : même itinéraire.","Rentré de Lausanne en début d'après-midi, avec comme objectif (1) l'achat d'un casque de rando et (2) entraînement long. Départ en début d'après-midi, par temps couvert. Les sensations sont bonnes tout le long de la montée, comme pour Laurent d'ailleurs. Arrivé à proximité du sommet, un petit portage pour apprécier la vue embrumée sur Derborence. Les quelques premiers mètres de la descente se font à pied pour ma part, alors que Laurent plonge déjà dans le ""couloir"" est.",2,1,0,0,0,-0.012225,-0.072112,46.3023,7.2800,
2020_01_26_grand_chateau,26.1.2020,Grand Château,"Saillon, Haut d'Ovronnaz",VS,PD+,2575499,1115466,2497,1368,1129,2,Gilles,"Au départ d'Ovronnaz (1368m), remonter en directiion de Petit pré, en suivant les itinéraires de randonnées. Une fois Petit pré atteint (1998m), se dirgier à l'ouest en direction de l'Euloi. Remonter sur le versent gauche, surplombé par le grand Château. Longer le pied de la falaise et atteindre le faux col situé entre le Grand et Petit Château (2400m). Déchausser les skis, et grimper la face ouest à pied (crampons potentiellement de mise) pour atteindre le sommet (2497m). Descente : redescendre par le couloir est (pente supérieures à 35° sur le sommet), pour rejoindre directement Petit pré.","Départ en milieu de matinée (9h00) depuis le début des installations (ne pas oublier le Magic Pass la prochaine fois). Monté tranquille, jusqu'à Petit pré. On poursuit en direction du pied du Grand Château; Gilles tire la langue (lui qui pensait partir du sommet des installations). Arrivé au pied de la face ouest, on déchausse les skis, Gilles enfilent ses crampons et le portage se fait rapidement (même si des crampons auraient été utiles de mon côté aussi). belle vue au sommet sur le Grand Muveran. La descente dans le couloir est impec, et on retourne déjà sur la station.",2,1,0,0,0,-0.024501,-0.084534,46.1902,7.1213,
2020_03_14_pas_de_lovegno,14.3.2020,Pas de Lovégno,"Val d'Hérens, St-Martin",VS,F,2603968,1113849,2696,1610,1086,2,"Simon, Jean-François","Au départ de St-Martin (Les Tsijeraches, 1610m), monter en direction du sud-est dans la forêt de Suen. Passer à distance de l'Alpage de Lovégno (2149m), via Plan Zenevrec. Remonter le couloir à l'est, et passer au pied des Réchasses (2492m). Poursuivre en direction du sud-est, pour rejoindre le Pas de Lovégno (2696m). Descente : par le même itinéraire.","Départ assez tardif de St-Martin (9h00). La montée est relativement tranquille et le temps au beau fixe. On arrive rapidement au Pas de Lovégno, et on profite de la vue sur la Maya, majestueuse. Le froid et le vent nous poussse à redescendre assez rapidement (on attend les copains les gus !). Descente agréable avec une belle tolée de Simon à mi-course. Arrivé à la Kangoo, la deuxième partie de la sortie débute : les Celliers, Provin et la PDA, on a pas fini de repousser le début du confinement (merci le COVID), à grand coup de rouge et de bières.",1,1,0,0,0,0.003968,-0.086151,46.1761,7.4900,
2021_01_23_pizzo_del_naret,23.1.2021,Pizzo del Narèt,"Val Bedretto, Ossasco",TI,PD,2685614,1147896,2588,1320,1268,3,"Gilles, Delphine, Agathe","Au départ d'Ossasco (1320m), de diriger en direction de la forêt vers le sud. Suivre les indications en direction de l'Alpe di Cristallina. À la lisière de la forêt, remonter le Vallon jusqu'à l'Alpe di Cristallina (1800m). De là, poursuivre sur la rive ouest, en se pressant lors du passage sous les pentes à 35-40° à l'est. Au sommet du Vallon, se diriger vers le sud-est, en direction du Passo del Narèt (2437m); rejoindre ce dernier après une courte section à plus de 30°. Une fois le col atteint, entamer la montée finale vers le sommet du Pizzo del Narèt, en bifurquant vers le sud-ouest. Le sommet (2588m) est atteint après une brève montée sans difficulté. Descente : même itinéraire.","Premier jour de rando pour ce weekend au Tessin. Départ relativement tardif (10h00). La première section jusqu'à la lisière de la forêt se fait sans encombre. Après avoir passé l'Alpe di Cristallina, on découvre de belles coulées descendues des pentes à l'ouest (le bulletin les avait annoncées !). Au sommet du Vallon, la fatigue commence à se faire sentir chez certains d'entre nous. Après la montée du mur jusqu'au col, Agathe décide de rester à celui-ci; Delphine et moi en tête, Gilles en crampon, on atteint finalement le sommet, avec une vue magnifique sur des montagnes inconnues. La descente est agréable, malgré quelques chutes.",1,1,0,0,0,0.085614,-0.052104,46.4769,8.5532,
2021_01_24_quotta_2501,24.1.2021,Quotta 2501,"Val Bedretto, All'Acqua",TI,F,2677389,1146310,2498,1612,886,3,"Gilles, Delphine, Agathe","Au départ d'All'Acqua (1603m), entamer la montée en direction du sud-ouest, dans une forêt clairsemée. Se diriger en directon de l'Alpe di Formazzora (2098m). Une fois ce dernier atteint, poursuivre en direction de l'Alpe San Giacomo (2288m), en suivant les lignes électriques, puis se dirigier vers le Passo San Giacomo (2306m). Depuis là, s'orienter vers le nord-ouest, en direction d'un sommet peu marqué. Après 200m de montée additionnelle, le sommet est atteint à ski (2498m). Descente : même itinéraire.","Deuxième jour de rando pour ce weekend au Tessin. Départ une nouvelle fois tardif (10h00). La première section jusqu'à la lisière de la forêt se fait sans encombre, malgré les jambes de la veille qui piquent un peu. Au niveau du premier alpage, la tempêtes se lève : de grosses bourasques de vent nous balayent; on a froid au bout de doigts, mais la vue sur les sommets soufflés est magistrale! On atteint rapidement le col, et on décide de mettre un pied en Italie pour rejoindre le sommet. De là haut, belle vue sur les sommets bernois lointains au nord, et sur quelques cimes tessinoises et italiennes au sud. Les conditions à la descente dont à nouveau au top!",2,1,0,0,0,0.077389,-0.05369,46.4636,8.4459,
2021_02_27_sublage,20.2.2021,Le Sublage,"Savièse, Sanetsch",VS,PD+,2590400,1130350,2735,1400,1335,2,"Simon, Jean-François","Au départ de la Grand Zour (1400m), suivre la route du Sanetsch jusqu'à Vuagno sur 2km. Emprunter l'ancienne route pour rejoindre le Scex (1673m). Poursuivre en direction des alpages sur les hauteurs, en coupant à travers les paturages. Rejoindre le pied du Sublage en longeant la falaise donnant sur la vallée du Sanetsch à l'est. Après une courte section à 35°, longer le pied de la face sud du Sublage, puis remonter tranquillement vers le sommet par la crête est (2735m). Descente : même itinéraire.","Veillée le vendredi soir au chalet de JF (pizzas 5 étoiles et presque rien bu). Départ le samedi à l'aube (note à Simon: ne pas rater le premier virage en sortant du chalet). Départ tranquille, puis lever de soleil dans les alpages au dessus du Scex. Dernière section relativement difficile physiquement (quelques crampes dans le groupe dues au rouge de la veille). Descente royale, sur de la neige juste fondue, puis retour à Coppet pour la fondue.",1,1,0,0,0,-0.0096,-0.06965,46.3245,7.3140,
2021_03_07_pointe_tourtemagne,6.3.2021,Pointe de Tourtemagne,"Val d'Anniviers, St-Luc",VS,PD+,2617224,1117004,3082,1694,1388,1,"Simon, Jean-François","Au départ de Prillet (1964m), remonter le long de la piste (itinéraire de randonnée) jusqu'à Combavert (2199m). De là, prendre la route en direction de l'hôtel Weisshorn. Couper sur la gauche, dans la combe en direction de Vijivi. Poursuivre en direction du lac du Toûno (2660m). Entamer la montée finale, relativemenr raid, en direction de la pointe de Tourtemagne. Juste avant le sommet (3082m), éventuellement se décaler sur la droite pour atteindre le sommet secondaire (3069m), moins fréquenté. Descente : même itinéraire.","Départ relativement tardif (9h30), en raison du retour de conditions quasi hivernales. La première section sur la piste est une véritable patinoire. Une fois Combavert atteint, le Toûno se présente a nous..mais pas pour ajourd'hui. La suite de la montée de fait tranquillement. Dans la dernière section, les rayons de midi commencent à tapper fort (et les coups de soleil qui vont avec). Au sommet, on se dirige vers le sommet secondaire, pour un pic-nic grandiose avec vue sur le Cervin. La descente se fait sans encombre; pas du grand ski, mais la bière chez JF est méritée!",1,1,0,0,0,0.017224,-0.082996,46.2043,7.6617,
2021_03_14_mont_etoile,13.3.2021,Mont de l'étoile,"Val d'Hérens, Arolla",VS,AD,2600892,1102483,3369,1835,1534,2,Gilles,"Au départ de la Gouille d'Arolla (1835m), suivre le chemin en direction du Lac bleu (2100m). Au lac, bifurquer sur la droite en suivant les indications pour la cabane des Aiguilles rouges. Une fois à hauteur de celle-ci, le Mont de l'étoile se dévoile. Prendre la direction du Faux col de Darbonnaire. À mi-course, bifurquer sur la droite et rejoindre le pieds du Mont. La montée de la crête sud-ouest pour rejoindre le sommet (3369m) se fait à pieds en cas de faible couverture neigeuse. Descente : par la face sud du Mont, puis se diriger dans le Vallon pour rejoindre le lac.","Départ matinal (8h00). La première partie se déroule sans encombre et le temps est au beau fixe (malgré des conditions tempetueuses annoncées). Une fois la cabane des Aiguilles rouges atteinte, ça se complique: Gilles particulièrement dans le dur, arrive le souffle court au pied du Mont.  On tente la montée en crampon, mais on abondonne presqu'au sommet (rafale à 100km/h sur une arrête, à éviter). Belle descente par une autre route (en longeant la cascade de glace).. et en évitant les plaques à vent que d'autres ont déclanchées!",1,1,0,0,0,0.000892,-0.097517,46.0739,7.4502,
2021_03_20_pointe_du_tsate,20.3.2021,Pointe du Tsaté,"Val d'Hérens, La Forclaz",VS,PD,2608528,1106436,3078,1726,1352,3,"Simon, Nicola, Andrea, Ludovico","Au départ de la Forclaz (1725m), monter en direction de la forêt, à travers les chalets. Poursuivre en direction du sommet de la remontée du Tasté (2209m). De là, se diriger vers le nord-est, en direction du Remointse du Tsaté (2480m); atteindre ce dernier après une courte section à 35°. Poursuivre en direction du nord-est en longeont la crête. Une fois le lac du Tsaté passé (2713m), rejoindre le sommet (3078m) en poursuivant le long de la crête. Descente : même itinéraire.","Départ de Sion à 7h30, après avoir récupéré Nicola venu depuis Berne. Après le 1/4 d'heure italo-vaudois, on entame la montée jsute avant 9h00, Simon en tête. Le premier passage jusuqu'au sommet des installations se fait à bon pas. Sur la section supérieure de la course, les premiers signes de fatigue se font sentir (la chaleur y est pour quelque chose). On poursuit en direction du sommet en faisant l'accordéon. Le sommet est atteint vers 12h15. Belle vue sur les 4000 de la région, malgré un peu de vent au sommet. La descente est agréable sur la première section (neige un peu lourde), mais peu de neige sur le fond.",2,1,0,0,0,0.008528,-0.093564,46.1094,7.5489,
2021_04_02_mont_blanc_de_cheilon,2.4.2021,Mont Blanc de Cheilon,"Val d'Hérens, Val des Dix",VS,AD,2598348,1093508,3870,2100,1770,2,"Laurent, Simon, Jean-François, Gilles, Fabien, Romain","Au départ d'Arolla (2100m), monter sur les pistes en direction du Pas de Chèvre (2854m). Descendre les échelles, puis rejoindre le glacier en descendant queqlues dizaines de mètres. Remonter sur le glacier en suivant les traces, en direction du Col de Cheilon (3236m). Arrivé au col, longer le fond de la pente, en contrebas des séracs. Bifurquer sur la gauche et entamer la monté finale en contournant les crevasses. Arrivé au sommet de la langue glacière, déposer les skis pour atteindre le sommet d'hiver à pied (3827m). Descente : même itinéaraire.","Départ de Sion à 5h00, après avoir réuni le groupe sous la direction de Romain, notre guide du jour. Sur les skis à 6h00, la première partie jusqu'au Pas de Chèvre se fait (trop) rapidement, sous une heure bleu magnifique! La remontée du glacier, peu crevacé, se fait tout tranquillement. Au col, les choses se gâtent un peu; Gilles, fatigué par l'altitude, est dans le dur. On se répartit le contenu de son sac, et en serrant les dents, tout le monde arrive au sommet. Vue magnifique sur les sommets aux 4 points cardinaux! On redescend en 1h30 sur Arolla (la rwmontée du Pas de Chèvre fait mal), et finit sur une bonne bière bien méritée... avant d'aller déguster les crus de la cave des bouquetins!",1,1,0,0,0,-0.001652,-0.106492,45.9931,7.4173,
2021_04_05_tete_de_ferret,5.4.2021,Tête de Ferret,"Val Ferret, La Fouly",VS,PD+,2571900,1082684,2713,1596,1117,1,Simon,"Itinéraire en circuit, via la Dotse. Au départ de la Fouly (1596m) se dirgier en direction de Ferret (1699m). Avant le hameaux, couper sur la droite et traverser le pont menant à la piste de ski de fond (1649m). De là, entamer la monté le long du Crêtet de Létemeyre (section intéermédiaire à plus de 30°). Après une élévation d'environ 800m, atteindre le sommet de la Dotse (2491m). Se diriger vers l'ouest et entamer la montée finale (250m) de la face sud de la Tête de Ferret (2713m). Descente : si les conditions sont bonnes, entamer la descente par la face nord (35°-40° sur plusieurs dizaines de mètres). Poursuivre en direction de la Fouly en empruntant la Combe des Fonds.","Départ à 8h00 tapante des Granges. La pyramide est en vue, au fond de la vallée. Les premier mètres sont assez difficiles; en cause, la fatigue du weekend. Simon donne le rythme, et on a vite fait d'enfiler les couteaux. Le sommet de la Dotse est atteint en un peu moinds de 2h. Le temps de repérer la Pointe de Drône au loin, on enchaîne avec la montée finale vers la Tête de Ferret. Au sommet,vue magique sur les Alpes italiennes et sur les Aiguilles du côté français. On attaque la descente par la face nord, cartonnée, et on se laisse guider en direction de la Commbe des Fonds. Retour au T4, et direction Orsière, pour des cannettes de Ravioli et de Chili royales en drive in.",1,1,0,0,0,-0.0281,-0.117316,45.8952,7.0767,
2021_04_11_arpelistock,11.4.2021,Arpelistock,"Savièse, Sanetsch",VS,AD,2590499,1132504,3036,1520,1516,2,Simon,"Si l'ouverture de la route le permet, au départ de Vuagno (1520m) se diriger en direction du Scex (1749m). Poursuivre au nord, en direction de l'alpage de l'Inflora. Rejoindre le pied du Sublage (2486m) en longeant la falaise des Fonjales. Rejoindre le vallon situé entre le Sublage et le Sérac. Au dessus des Grand Gouilles, se dirgier vers le nord-ouest, en direction de l'Arpelistock. Poursuivre dans la combe, puis en longeont l'arrête sommitale à mi-distance. Juste avant le sommet (2943m), déchausser les skis et remonter les 80 derniers mètres à pieds (pente à presque 40°). Descente : par le même itinéraire.","Départ à 5h50 de Savièse. La fatigue de la semaine se fait (plus) que sentir. Départ à pieds depuis Vuagno; après 2-3 km de nordic walking, on chausse finalement les skis à l'Inflora. La remontée jusqu'au pied du Sublage se fait tranquillement. Au dessus des Grand Gouilles, le nouveau terrain de jeu se dévoile; quelques avalanches impressionnantes sur les faces situées au nord nous incitent à la prudence. On remonte prudemment jusqu'à la fenêtre de l'Arpelistock, déchausse les skis, et décide de rebrousser chemin à mi-parcours; les plaques à vents ne m'inspirent pas confiance. La descente est agréable, une bonne moquette.. jusqu'à l'Inflora, où on remet les skis sur le dos.",1,1,0,0,0,-0.009501,-0.067496,46.3439,7.3152,
2021_04_17_pointe_d_aufalle,17.4.2021,Pointe d'Aufalle,Ovronnaz,VS,AD,2575020,1118460,2727,1723,1700,2,"Simon, Gilles, Nicolas M., Nicolas C.","Itinéraire sur 2 jours. 1er jour : au départ de Loutze (1723m), se diriger à l'est en direction de Chamosentse (1908m), puis remonter le vallon en direction des Gouilles Rouges (2507m). De là, rejoindre la cabane Rambert (2583m). 2e jour : descendre par Plan Salentse, puis par Plan Coupel. À hauteur du Pessot (2000m), longer la falaise pour rejoindre le pied des couloirs jumeaux. Déchausser sur la dernière section (40°) pour rejoindre le Tsalan (2300m). Poursuivre vers l'ouest en direction du faux-col, puis obliquer vers le nord-ouest; déchausser dans la face terminale au besoin (40°), pour atteindre le sommet. Descente : par le même itinéraire jusqu'à Saille, puis redescendre directement sur la station.","Vendredi soir, départ tardif avec Simon et Gilles (18h30) de Loutze. On se dépêche de monter en direction de la Rambert, où nous attendent Moulin et Mr. Klaus. Arrivés juste avant la tombée de la nuit (et de la tempête), on découvre un local d'hiver 5 étoiles. Après une bonne nuit, on attaque la descente par les deux Plans, prudemment. La remontée des couloirs jumeaux est technique, les conversions ne suffiront pas. La montée finale se fait à un rythme tranquille (la fatigue se fait sentir) et on atteint le sommet: vue magnifique sur le Chablais, le Léman et les préalpes. On redescend dans la poudre de qualité et rejoint la station en skiant presque sur l'herbe.",1,1,0,0,0,-0.02498,-0.08154,46.2171,7.1150,
2021_04_24_pointe_de_drone,24.4.2021,Pointe de Drône,"Val d'Entremont, Gd-St-Bernard",VS,AD+,2578160,1080855,2949,1914,1035,2,"Simon, Gilles, Lucien","Itinéraire sur 2 jours, en circuit via la Grande Chenalette. 1er jour : au départ du parking de Bourg-St-Bernard (1914m), montée en direction du col du Grand-St-Bernard (2469m). Attention au passage de la combe des Morts (2276m). 2e jour : depuis le col, se diriger vers l'est et grimper en direction de la Petite Chenalette. À mi-parcours, obliquer sur la droite, sous la Grande Chenalette ( 2890m). Déchausser et atteindre le sommet en empruntant la pente entre les rochers (40° sur 100m). Rejoindre la Pointe de Drône (2949m) à plat, au nord-ouest. Descente : 100m à l'est du sommet, plonger dans la face nord (sommet à 40° et 35° sur 300m) et redescendre par la Combe de Drône.","Vendredi soir, départ à 17h30 de Bourg-St-Bernard et arrivée au col à19h15, juste pour l'heure du souper. La soirée estt arrosée, en compagnie de Rapahel, chanoine du col. Le lendemain, après une courte nuit, départ à 9h30 en direction de la Grande Chenalette. Après le porté un peu technique sous le commet (merci Simon pour les marches), la Pointe de Drône n'est plus qu'à quelques minutes de marche. Au sommet, Gillles et Lucien décident de descendre directement sous la pointe; Simon et moi-même empruntont l'entrée normale. La descente est agréable, quoiqu'un peu cartonnée, et nous ouvre l'appétit: la sortie se finit sur un burger-terrasse post-covid à Martigny.",1,1,0,0,0,-0.02184,-0.119145,45.8790,7.1574,
2021_12_18_monts_telliers,18.12.2021,Monts Telliers,"Val d'Entremont, Gd-St-Bernard",VS,PD,2577231,1083014,2951,1914,1037,2,"Simon, Marc, Gilles, Lucien","Au départ du parking de Bourg-St-Bernard (1914m), montée en direction du col du Grand-St-Bernard. À hauteur de La Pierre (2039m), bifurquer sur droite en traversant la Dranse. Commencer à remonter la Combe de Drône en direction ouest/nord-ouest. Bifurquer sur la droite en direction du lac du Grand Lé (2553m). Poursuivre en direction des Mont Telliers. Les 300m se font facilement à ski, afin d'atteindre le sommet (2951m). Descente : par la Combe de Drône.","Première sortie de la saison avec 2 saviésans et 2 ""bas-valaisans-centraux"" (qu'on aura attendus 45min durant au parking). Départ aux environs de 9h30. La montée se passe sans encombre, mais le souffle est un peu court (merci la prise de sang effectuée il y a quelques jours). À unue centaine de mètres du sommet, petite chutte de Lucien; plus de peur pour son ski vagabon que pour le reste. Belle vue sur les Lacs de fenêtre et environ depuis le sommet. À la descente, on rabbotte un peu les semelles (peu de neige en ce début de saison). La sortie se finit sur un gros burger-röschti à Orsières.",1,1,0,0,0,-0.022769,-0.116986,45.8984,7.1454,
2022_01_15_le_metailler,15.1.2022,Le Métailler,"Vallon de la Printse, Nendaz",VS,PD,2593948,1105836,3212,1734,1478,2,Simon,"Au départ de Siviez (1734m), remonter le long de Novelly jusqu'à hauteur des Chottes (1862m). Poursuivre au sud, le long du chemin pédestre, en direction de Maretse, puis de Chervé (2261m). De là, remonter le long du Chervé, dans le vallon, jusqu'à hauteur de Crouye Grandze (2700m). Se diriger vers le sud/sud-est pour rejoindre l'arrête  ouest du Métailler (2957m). Remonter l'arrête sur 150m pour arriver sur la partie finale de celle-ci. Déchausser sur les 100 derniers mètre pour atteindre le sommet d'hiver (3140m). Descente: par le même itinéraire.","Arrivée sur le parking de Siviez en Kangoo à 9h30. Après avoir peiné à trouver le bon chemin de départ, on attaque la montée sur un rythmme solide. Après avoir dépassé quelques groupes, arrivée dans le Vallon du Chervé : on y trouve enfin le soleil. La fin de la montée se déroule sans grand soucis, juste le souffle un peu court au dessus de 3000m. Une fois le sommet d'hiver atteint, on hésite à poursuivre plus haut, mais choix est fait de redescendre par le même chemin. Vue magnifique sur les Combins, et les 4000 en direction du Haut-Valais Descente en assez bonnes conditions, malgré le peu de neige... et de jambes.",1,1,0,0,0,-0.006052,-0.094164,46.1040,7.3604,
2022_01_22_rottallihorn,22.1.2022,Rottällihorn,"Urserental, Realp",UR,PD+,2678745,1155192,2914,1537,1377,2,"Simon, Gilles, Jean-François, Nicolas M.","Au départ de Realp (1537m), remonter le long de la Furka Reuss jusqu'à un pont (1603m). Remonter la route jusqu'à Hinterschweig (1743m). Emprunter le chemin d'hiver en direction de la Rotondohütte. Remonter le long du Stellibodenbach. Une fois le sommet du vallon atteint, poursuivre en direction du sud-ouest. Longer le Rottälligrat par le nord. Rejoindre le pied de l'arrête sud-est du Rottällihorn par la combe nord-est. Au pied de l'arrête, déchausser et monter les derniers 100m à pied jusqu'au sommet (2914m). Descente: si les conditions le permettent, descendre par la face est (45° au sommet). Emprunter éventuellement la route d'été à la descente pour éviter de rechausser les peaux.","Départ tardif de Realp à 10h30, après la raclette de la veille et une légère embrouille à base d'accent saviésan. L'ambiance revient au beau fixe rapidement avec une montée mi-ensoleillé, mi-tempêtueuse. Après s'être trompé de route, on se rend finalement ""au grand"" sommet du jour. Jolie montée le long de l'arrête, et belle descente dans la face est. De retour au fond de la vallée, la journée se termine avec bières et burgers à Andermatt.",1,1,0,0,0,0.078745,-0.044808,46.5434,8.4651,
2022_01_30_l_omen_roso,30.1.2022,L'Omen Roso,"Val d'Anniviers, St-Luc",VS,PD,2617109,1113683,3031,1694,1337,1,"Simon, Nicola, Elio, Valentin","Au départ de Prillet (1964m), remonter le long de la piste (itinéraire de randonnée) jusqu'à Combavert (2199m). De là, prendre la route en direction de l'hôtel Weisshorn. Couper sur la gauche, dans la combe en direction de Vijivi. Remonter le Tsa du Toûno, jusqu'à rejoindre le faux col de Bella Vouarda (2621m). Longer la chaîne de montagne sur la gauche afin de rejoindre le pied de l'Omen Roso. Rejoindre l'épaule ouest de et remonter en direction du sommet de l'Omen Roso (3031m). Descente: par le même itiniéraire.","Arrivée sur parking de Prillet à 9h00 avec une délégation alémano-romande. Début de montée sur les chapeaux de roues avant d'arriver sur le Tsa du Toûno, tout en longeur. Une fois le faux col atteint, Nicola est à bout, mais la motivation est vite retrouvée. Dernière montée tranquille et belle vue sur le Weisshorn au sommet. À la descente, Elio plante un ski, Valentin deux, et Nicola poussera sa split avec les bâtons. Bières, planchettes et tartes aux myrtilles bien méritées à l'Hôtel Weisshorn!",1,1,0,0,0,0.017109,-0.086317,46.1744,7.6601,
