File,Date,Course,Region,Canton,Difficulte,X_map,Y_map,Elevation_max,Elevation_min,Elevation,Risque,Groupe,Itineraire,Recis,DistanceGPX,SkiRando,Marche,Velo,Camping,X_norm,Y_norm,Latitude,Longitude,Strava
2022_02_06_palantse_de_la_cretta,6.2.2022,La Palantse de la Cretta,"Val d'Hérens, Les Haudères",VS,F,2601500,1104746,2929,1795,1134,3,Gilles,"Au départ de la Coutaz (1795m), emprunter la route de l'étoile puis remonter en direction des mayens de la Coutaz (1971m). Poursuivre dans la pente en pour rejoindre le Remointse de la Cretta (2396m). Poursuivre la montée avant d'obliquer légèrement en direction du nord/nord-est, puis rejoindre le sommet à ski (2929m). Descente: par la même itinéraire, en empruntant possiblement la pente sous le Bèche de la Cretta, et en longeant la Bornette par la droite.","Départ des échuttes à 8h00 et skis aux pieds à 9h00. Plaisir de retrouver Gilles pour une petite sortie en duo dans le Val d'Arolla. Montée sous le soleil dès le début, ça chauffe (en sus de la sortie Fava de la veille et de la fatigue accumulée depuis le début de l'année). Gilles, munis de ses presque flambant neufs"" BR Camox, mène le train (il le mènera tout le long...). Arrivée au sommet en compagnie de quelques dizaines d'aventureux-ses: une course sûre par un degré 3 un peu traître. Très belle descente, avec de la bonne neige sur le sommet, avant un pic-nic idyllique surle parking de la Coop.",1,1,0,0,0,0.0015,-0.095254,46.0942,7.4580,
2022_02_12_mont_buet,12.2.2022,Le Mont Buet,"Vallée de Chamonix, Vallorcine",FR,PD+,2554615,1097195,3096,1329,1767,3,Laurent,"Au départ du Buet (1329m), remonter le vallon de l'Eau de Bérard sur plusieurs kilomètres en direction du Refuge de la Pierre à Bérard (1924m). Poursuivre en direction du nord-ouest, en visant l'Aiguille de Salenton, par des pentes parfois  raides (> 35°). Une fois le pied de l'Aiguille atteint (2519m), remonter la large combe exposée sud en direction du relais radio. À hauteur de ce dernier, rejoindre le sommet du Mont Buet (3096m) en longeant la large arête de la Mortine. Descente: par le même itinéraire. Descente alternative possible par la face sud.","Lever aux aurores pour démarrer les skis aux pieds à 7h30. La remontée du vallon se fait à toute vitesse, en dépassant plusieurs groupes pour la peine. Arrivés au refuge, le traçage de la route nous incombe. En suivant approximativement le tracé (à travers des pentes parfois un peu raides pour du degré 3), on atteint sans trop de problème le dernier mur. Un sympathique  local nous montre le chemin jusqu'au sommet. Vue à 360° splendide et descente royale, avant de retrouver l'hôtel et son spa (après une sortie détox avec Elise aux Houches).",1,1,0,0,0,-0.045385,-0.102805,46.0248,6.8526,
2022_02_26_wildhorn,26.2.2022,Wildhorn,"Ayent, Rawyl",VS,PD+,2594010,1133710,3250,1767,1483,2,"Simon, Jean-François, Gilles, Nicolas C.","Au départ des Rousses (1767m), remonter en direction du Serin (1942m). Longer le pied de la falaise de Poédasson avant de rejoindre le fond de la combe des Andins (2100m). Remonter cette dernière afin de rejoindre le plateau des Audannes. Poursuivre en direction du Nord, sans obliquer vers la cabanne, jusqu'à atteindre le fond de la pente menant menant au plateau du glacier. Une fois le glacier atteint, remonter ce dernier, peu cerevassé, toujours vers le nord. Rejoindre le sommet via une dernière rampe de neige (3250m). Descente: par la même itinéraire.","Lever au petit matin, un samedi de carnaval. Départ à 7h45 des Rousses, pour une longue montée. Compact jusqu'aux Andins, le groupe se sépare en deux: on retrouvera Simon plus loins vers les Audannes, et JF au sommet. Arrivés sur le glacier, le vent se lève. La vue au sommet est magnifique, mais le vent nous force à repartir rapidement. Belle descente, mais avec quelques plats sur lesquels il est nécessaire de pousser. De retour aux Rousses, on s'accorde bières, rouge et croûtes aux champignons avant d'enchaîner sur le samedi de Carnaval à Sion.",1,1,0,0,0,-0.00599,-0.06629,46.3547,7.3608,https://www.strava.com/activities/6740413720
2022_03_08_schwarzhorn,8.3.2022,Schwarzhorn - Leuk,"Leukerbad, Massif du Wildstrubel",VS,PD+,2610882,1136997,3105,2315,790,1,Simon et CAS,"Au départ du Gemmipass (2315m), se diriger vers l'ouest, en direction du Lämmerenboden. Traverser ce dernier, jusqu'à atteindre l'ouest du monte charge de la Lämmeren Hüte. Remonter vers l'ouest, jusqu'à atteindre un plateau (2473m). Monter en direction du Lämmerengletescher, en surplombant les pentes rocheuses. Une fois, le glacier atteint (2700m), remonter en direction du sud-est, jusqu'à atteindre la dernière pente sommitale. Remonter cette dernière jusqu'au sommet (3105m). Descente: par le même itinéraire. Possibilité d'obliquer vers l'est à 2700m, via une traverse, pour rejoindre une jolie combe exposée nord.","Deuxième course de la formation CAS. Départ à 8h00 de la Gemmi. La traversée du plat de Lämmeren est glaciale. Après un dépôt à proximité de la cabane, nous entamons la montée en direction du Schwarzhorn. Nous dépassons assez rapidement un groupe de collègiens, que nous retrouverons au sommet. Une fois sur le glacier, nous nous exerçons à la marche encordée. Le sommet est rapidement atteint, avec une vue à couper le souffle sur les Alpes valaisannes. Jolie descente pour rejoindre la Lämmeren Hütte, pour s'exercer aux ancrages et notre première nuit en cabane.",1,1,0,0,0,0.010882,-0.063003,46.3843,7.5801,
2022_03_09_wildstrubel,9.3.2022,Wildstrubel/Lenkerstrubel,"Leukerbad, Massif du Wildstrubel",VS,PD,2606923,1138777,3244,2503,741,1,Simon et CAS,"Au départ de la Lämmeren Hütte, se dirgier vers l'ouest pour atteindre un replat (2450m). Remonter en direction du nord-ouest, pour rejoindre le fond du glacier du Wildstrubel. Aborder ce dernier par la langue glacière supérieure (2800m). Remonter le glacier en revenant vers l'ouest, tout en se dirigeant vers le sommet du dôme du Wildstrubel. Atteindre le sommet de ce dernier à ski (3244m). Descente: par le même itinéraire ou par le sud-ouest du glacier, en passant au sud des séracs.","Troisième course de la formation CAS. Départ à 8h00 de la Lämmeren Hutte. La montée se fait à par un grand soleil. Arrivés sur le glacier, nous enfilons les baudriers pour un exercice de marche encordée. Arrivés sur le haut duu glacier, le dôme du Wildstrubel se dévoile. Au sommet, vue splendide à 360°, sur les Alpes valaisannes,  bernoises, françaises et les préalpes. La descente par le sud-ouest du glacier est elle aussi superbe. La journée se poursuit avec un exercice de mouflage.",1,1,0,0,0,0.006923,-0.061223,46.4003,7.5286,